id;city;img;hint1;hint2;hint3;hint4
and_andorra;Andorra la Vella;[Link foto del valle nevado y arquitectura pirenaica];Capital de un coprincipado situado en la cordillera de los Pirineos;Se asienta como la capital de Estado más alta de toda Europa;Su economía depende masivamente del turismo de nieve y de los comercios libres de impuestos;La ciudad se ve encajonada en un estrecho y escarpado valle montañoso repleto de centros comerciales
lux_luxemburgo;Ciudad de Luxemburgo;[Link foto de las fortificaciones y el balcón de Europa];Capital de uno de los pequeños y más ricos Estados fundadores de la Unión Europea;Conocida antaño como la Gibraltar del Norte debido a sus inexpugnables defensas;El trazado urbano se divide dramáticamente entre una zona alta y un cañón o valle inferior muy profundo;Se observan gigantescos muros de piedra y casamatas que bajan hacia un verde y profundo desfiladero
mco_monaco;Mónaco;[Link foto de Montecarlo con el casino y yates];Microestado soberano en la costa mediterránea francesa;Se rige por una monarquía cuya familia ha atraído mucha prensa rosa;No cobra impuestos sobre la renta atrayendo a múltiples millonarios;En la foto destaca un lujoso casino rodeado de coches deportivos y un puerto repleto de yates inmensos
smr_san_marino;San Marino;[Link foto de la torre asomada al abismo];Microestado enclavado completamente dentro del territorio italiano;Afirma ser la república soberana y constitucional más antigua del mundo;Su centro histórico está construido en lo alto del escarpado Monte Titano;Aparece una antigua torre defensiva de piedra asomada literalmente al borde de un espectacular precipicio
mlt_valeta;La Valeta;[Link foto del puerto y cúpulas doradas];Capital de Malta en pleno mar Mediterráneo;Fundada por los Caballeros Hospitalarios tras un gran asedio;Una de las ciudades fortificadas más impresionantes de Europa;La vista muestra edificios de piedra caliza dorada con característicos balcones cerrados de madera de colores
lie_vaduz;Vaduz;[Link foto del castillo principesco sobre el pueblo alpino];Capital del minúsculo principado de Liechtenstein;Se encuentra apretada entre Suiza y Austria;Es uno de los centros financieros más herméticos y curiosos del continente europeo;Muestra un imponente castillo de piedra encaramado en una verde ladera de los Alpes mirando hacia un pequeño valle
vat_vaticano;Ciudad del Vaticano;[Link foto de la Plaza de San Pedro y la Basílica];El Estado soberano y reconocido internacionalmente más pequeño de la Tierra;Sede central de la Iglesia Católica Romana;Sus fronteras están delimitadas casi en su totalidad por muros de piedra dentro de Roma;La foto está dominada por una descomunal plaza elíptica abrazada por columnatas y una gigantesca cúpula renacentista
