id;city;img;hint1;hint2;hint3;hint4
prt_coimbra;Coimbra;[Link foto de la Universidad vieja o la Biblioteca Joanina];Ciudad en el centro de Portugal a orillas del río Mondego;Fue la capital del país durante un breve periodo en la Edad Media;Conocida principalmente por su histórica universidad y la tradición de las capas negras estudiantiles;Muestra un majestuoso complejo universitario en lo alto de una colina o una biblioteca barroca adornada con oro
prt_aveiro;Aveiro;[Link foto de los canales y los barcos moliceiros];Ciudad situada en la costa oeste de Portugal;Su postre típico son los dulces de huevo envueltos en oblea (ovos moles);Es frecuentemente llamada la Venecia portuguesa debido a su red de canales;La imagen muestra canales surcados por unas coloridas y tradicionales embarcaciones parecidas a góndolas
prt_evora;Évora;[Link foto del Templo Romano o la Capilla de los Huesos];Capital de la región del Alentejo en el sur de Portugal;Toda la ciudad está considerada ciudad-museo por la UNESCO;Destaca por su misteriosa capilla forrada con cráneos y huesos humanos;Aparecen las ruinas de un templo romano con columnas corintias en medio de una plaza
prt_madeira;Funchal;[Link foto de las casas subiendo la colina frente a la bahía];Capital de un archipiélago atlántico perteneciente a Portugal;El aeropuerto local lleva el nombre de un famoso futbolista nacido allí;Famosa por su vino fortificado su clima primaveral y los descensos en cestos de mimbre;Se ve una ciudad construida en un empinado anfiteatro natural verde mirando al océano Atlántico
grc_atenas;Atenas;[Link foto del Partenón en la Acrópolis];Capital europea con más de tres mil años de historia;Considerada el lugar de nacimiento de la democracia occidental;Coronada por un monte con templos dedicados a dioses antiguos;La imagen muestra el Partenón o ruinas de templos de mármol con gruesas columnas
grc_santorini;Oia;[Link foto de las cúpulas azules y el mar Egeo];Pueblo situado en una isla volcánica del mar Egeo;Famosa por tener uno de los atardeceres más codiciados del mundo;Pertenece a Grecia;El paisaje muestra casas de un blanco nuclear con tejados redondeados de color azul brillante
grc_meteora;Meteora;[Link foto de los monasterios en lo alto de las rocas];Complejo religioso ubicado en el norte de Grecia;Su nombre significa suspendido en el aire;Fue refugio de monjes ortodoxos que buscaban aislamiento extremo;La foto muestra monasterios construidos justo en la cima de pilares gigantes de roca natural
grc_zante;Playa del Naufragio;[Link foto de la bahía con el barco oxidado];Atracción turística en las Islas Jónicas griegas;Solo se puede acceder a ella mediante barco;Su fama se debe a un barco contrabandista que quedó varado en los ochenta;La imagen muestra una playa de arena blanca rodeada de acantilados con un barco oxidado en el centro
grc_mykonos;Míconos;[Link foto de los molinos de viento blancos o la Pequeña Venecia];Isla del archipiélago de las Cícladas en Grecia;Es mundialmente célebre por su intensa y exclusiva vida nocturna;Destaca un barrio de pescadores donde los balcones cuelgan sobre el agua;En la foto se alinean unos icónicos molinos de viento blancos con techos de paja frente al mar
grc_creta;Cnosos;[Link foto de las ruinas rojas del Palacio de Cnosos];Sitio arqueológico ubicado en la isla más grande de Grecia;Fue el centro político y ceremonial de la civilización minoica;La mitología sitúa aquí el famoso laberinto del Minotauro;Muestra unas ruinas parcialmente reconstruidas con singulares columnas pintadas de color rojo oscuro
grc_delfos;Delfos;[Link foto del templo redondo de Atenea Pronaia o el estadio antiguo];Importante recinto arqueológico en la falda del monte Parnaso;Para los antiguos griegos era el centro del mundo marcado por la piedra Ónfalo;Albergaba el oráculo más famoso de la Antigüedad dedicado al dios Apolo;Aparecen unas ruinas clásicas entre montañas destacando un templo circular de columnas de mármol
hrv_dubrovnik;Dubrovnik;[Link foto de las murallas rodeando la ciudad];Ciudad costera del sur de Croacia bañada por el mar Adriático;Fue una poderosa república marítima rival de Venecia;Se hizo muy famosa por ser Desembarco del Rey en la serie Juego de Tronos;Muestra una ciudad antigua con tejados de color naranja completamente rodeada de murallas de piedra gruesa
hrv_split;Split;[Link foto del Palacio de Diocleciano y el paseo marítimo];Segunda ciudad de Croacia y puerto vital hacia las islas;Su casco histórico no es una ciudad normal sino el palacio de un emperador romano;El antiguo mausoleo imperial es hoy la catedral cristiana;En la foto se ve un largo paseo marítimo con palmeras frente a ruinas romanas de piedra blanca
hrv_plitvice;Lagos de Plitvice;[Link foto de cascadas y lagos turquesa];El parque nacional más antiguo y famoso de Croacia;Patrimonio de la Humanidad por su sistema cárstico único;Consiste en 16 lagos conectados por pasarelas de madera;Muestra una red espectacular de cascadas cayendo en pozas de agua color turquesa rodeadas de bosque
hrv_zagreb;Zagreb;[Link foto de la iglesia de San Marcos con su tejado de escudos];Capital y ciudad más grande de Croacia;A diferencia de los destinos turísticos principales del país no tiene costa;Es famosa por su peculiar Museo de las Relaciones Rotas;La imagen destaca una iglesia con un colorido tejado de tejas esmaltadas formando dos grandes escudos
hrv_zadar;Zadar;[Link foto del Órgano del Mar o las ruinas del foro romano];Ciudad histórica en la costa dálmata de Croacia;El cineasta Alfred Hitchcock dijo que tenía el mejor atardecer del mundo;Posee un curioso instrumento musical subterráneo que es tocado por el vaivén de las olas;Se observa un paseo marítimo de escalones blancos junto a un foro romano en ruinas
aut_viena;Viena;[Link foto del Palacio de Schönbrunn o la ópera];Capital de un país de habla alemana sin salida al mar;Cuna de la música clásica y el psicoanálisis;Famosa por sus cafeterías históricas y la tarta de chocolate Sacher;Se ve una ciudad imperial con palacios amarillos o un gran edificio de ópera clásico
aut_salzburgo;Salzburgo;[Link foto de la fortaleza sobre la ciudad];Ciudad alpina cerca de la frontera de Austria con Alemania;Su nombre significa literalmente Ciudad de la Sal;Mundialmente famosa por ser el lugar donde nació Mozart y donde se grabó Sonrisas y Lágrimas;La foto muestra un casco antiguo junto a un río coronado por una fortaleza blanca en la montaña
aut_hallstatt;Hallstatt;[Link foto del pequeño pueblo junto al lago alpino];Pueblo remoto en la región montañosa de Salzkammergut;Antiguamente solo accesible por barco o senderos de montaña;En China construyeron una réplica exacta de este lugar;Se ve un pequeño pueblo de madera con una aguja de iglesia junto a un lago cristalino reflejando los Alpes
aut_innsbruck;Innsbruck;[Link foto del Tejadillo de Oro o el salto de esquí];Capital del estado del Tirol en Austria;Ha sido sede de los Juegos Olímpicos de Invierno en dos ocasiones;Se sitúa en un amplio valle abrazado por montañas alpinas altísimas;El elemento más fotografiado es un balcón cubierto con tejas de cobre dorado reluciente
che_lucerna;Lucerna;[Link foto del Puente de la Capilla y la torre];Ciudad ubicada en la zona central de Suiza;Leyenda viva de Guillermo Tell cerca del lago de los Cuatro Cantones;Sufrió un incendio en 1993 que dañó su monumento principal;La imagen destaca un histórico puente cubierto de madera cruzando un río cristalino junto a una torre octogonal
che_zermatt;Zermatt;[Link foto del monte Cervino / Matterhorn];Pueblo alpino del sur de Suiza;Es un paraíso para el esquí donde están prohibidos los coches con motor de combustión;A sus pies descansa la montaña más icónica y fotografiada de Europa;La montaña que se ve en la foto es una pirámide de roca perfecta famosa por aparecer en las chocolatinas Toblerone
che_ginebra;Ginebra;[Link foto del Jet d'Eau en el lago];Ciudad francófona en el extremo occidental de Suiza;Es uno de los grandes centros de la diplomacia mundial albergando la Cruz Roja;Mundialmente reconocida por la industria de la relojería de precisión;Lo que más destaca en la foto es un inmenso chorro de agua blanca saliendo del lago
che_zurich;Zúrich;[Link foto de la ciudad junto al lago o las iglesias de Fraumünster];La ciudad más grande de Suiza aunque no es su capital política;Es considerada uno de los centros bancarios y financieros más fuertes del planeta;Situada en el extremo norte de un gran lago y rodeada de suaves colinas;Se observa una próspera ciudad dividida por el río Limmat con prominentes torres de iglesias de cobre verde
che_berna;Berna;[Link foto del casco antiguo envuelto por el río Aar o el foso de los osos];Capital política de la Confederación Suiza;Su animal heráldico es un oso que puede verse incluso en un gran foso real en la ciudad;Tiene un casco antiguo de calles empedradas y largos soportales declarados Patrimonio de la Humanidad;Muestra un recodo pronunciado de aguas turquesas rodeando una compacta península de casas medievales
nld_amsterdam;Ámsterdam;[Link foto de los canales y bicicletas o casas estrechas];Capital nacional aunque el gobierno no se sienta allí;Considerada un paraíso liberal por sus coffee shops;La casa de Ana Frank se encuentra en esta ciudad;Muestra vías acuáticas cruzadas por puentes de piedra repletos de bicicletas aparcadas y casas estrechas inclinadas
nld_rotterdam;Róterdam;[Link foto de las Casas Cubo amarillas o puente Erasmus];Segunda ciudad de los Países Bajos;Fue arrasada durante la Segunda Guerra Mundial y reconstruida con arquitectura moderna;Alberga el mayor puerto marítimo de toda Europa;En la foto se ven unas extravagantes casas amarillas con forma de cubos ladeados
nld_zaanse;Zaanse Schans;[Link foto de los molinos de viento verdes en línea];Pequeño barrio histórico cerca de Ámsterdam;Recrea la vida tradicional de los Países Bajos en los siglos XVIII y XIX;Es el mejor lugar para ver la fabricación de zuecos de madera y queso gouda;El paisaje muestra una hilera de clásicos molinos de viento verdes de madera a la orilla del agua
nld_lahaya;La Haya;[Link foto del Binnenhof o el Palacio de la Paz];Tercera ciudad más grande de los Países Bajos;Es la verdadera sede del gobierno de la familia real y de la Corte Internacional de Justicia;Tiene una conocida zona costera y de playa llamada Scheveningen;Destaca un majestuoso complejo de edificios gubernamentales históricos asomados a un estanque cuadrado
nld_utrecht;Utrecht;[Link foto de los canales hundidos de Utrecht];Cuarta ciudad en importancia de los Países Bajos y nudo ferroviario central;Alberga la universidad más grande del país y una icónica torre catedralicia separada de su nave;Sus canales son únicos porque tienen muelles y sótanos al nivel del agua;La foto muestra un canal profundo con terrazas de restaurantes literalmente al ras del agua bajo el nivel de la calle
bel_bruselas;Bruselas;[Link foto del Atomium o la Grand Place];Capital de un país que habla francés flamenco y alemán;Centro institucional y político de la Unión Europea;Mundialmente famosa por el chocolate la cerveza y la estatua de un niño haciendo pis;Puede que en la foto veas un monumento gigante de esferas plateadas conectadas como un átomo
bel_brujas;Brujas;[Link foto del campanario de Belfort o los canales medievales];Capital de Flandes Occidental;Su casco histórico es uno de los mejor conservados del medievo europeo;A menudo llamada la Venecia del Norte;Muestra calles empedradas canales oscuros y edificios de ladrillo con fachadas escalonadas
bel_gante;Gante;[Link foto del Castillo de los Condes de Flandes];Ciudad universitaria en la región de Flandes en Bélgica;Lugar de nacimiento del emperador Carlos V;Tiene uno de los castillos medievales con foso mejor conservados en medio de la ciudad;Se ve una sólida fortaleza de piedra gris rodeada de agua urbana
bel_amberes;Amberes;[Link foto de la estación de tren o el Grote Markt];Segunda urbe más poblada de Bélgica y corazón de la región flamenca;Es el principal centro mundial de tallado y comercio de diamantes;Alberga una de las estaciones de tren más bellas e impresionantes de Europa;La imagen destaca una fastuosa estación ferroviaria que parece una catedral con una enorme cúpula de cristal
cze_praga;Praga;[Link foto del Puente de Carlos o el Reloj Astronómico];Capital nacional situada en el centro de Europa;Salvada milagrosamente de los bombardeos masivos en el siglo XX;Es la patria de la cerveza pilsner y del escritor Franz Kafka;La imagen muestra un famoso reloj medieval con figuras doradas o un puente de piedra lleno de estatuas góticas
cze_kutnahora;Kutná Hora;[Link foto del osario con calaveras];Pequeña ciudad checa que compitió en riqueza con Praga por sus minas de plata;Patrimonio de la Humanidad por su singular arquitectura e historia macabra;Tiene una iglesia cuya decoración está hecha íntegramente con restos humanos;La foto es escalofriante ya que muestra candelabros y paredes adornadas con huesos y cráneos reales
cze_ceskykrumlov;Český Krumlov;[Link foto del meandro del río abrazando el castillo];Ciudad en la región de Bohemia Meridional de la República Checa;Mantiene intacto su aspecto medieval y renacentista al no sufrir guerras modernas;Está dominada por un enorme castillo que es el segundo más grande del país;Muestra un espectacular meandro en herradura del río Moldava rodeando un pintoresco pueblo con un castillo rosado
hun_budapest;Budapest;[Link foto del Parlamento junto al río o Baños Széchenyi];Capital de la nación magiar;Famosa por sus ruinas convertidas en pubs alternativos (ruin bars);Nació de la unión de dos ciudades separadas por el río Danubio;Aparece un enorme edificio neogótico junto al río que sirve como Parlamento del país
hun_pecs;Pécs;[Link foto de la Mezquita del Pasha Qasim en la plaza];Antigua ciudad universitaria en el suroeste de Hungría cerca de la frontera croata;Tiene una fuerte herencia de la época en que fue ocupada por el Imperio Otomano;Conocida por la cerámica de Zsolnay que adorna muchos de sus tejados;Destaca una plaza principal inclinada con una antigua mezquita turca coronada por una cruz cristiana
pol_cracovia;Cracovia;[Link foto de la enorme Plaza del Mercado y la Lonja];Antigua capital real de Polonia antes que Varsovia;Se cuenta que un dragón escupía fuego bajo su castillo principal;A poca distancia se encuentra la terrible historia de Auschwitz;Se observa una inmensa plaza medieval con un edificio central de ladrillo rojizo
pol_wieliczka;Minas de Sal de Wieliczka;[Link foto de la capilla tallada bajo tierra];Patrimonio histórico cerca de Cracovia en Polonia;Explotada sin interrupción desde el siglo XIII hasta hace muy poco;Alberga capillas y esculturas hechas exclusivamente de halita;La imagen muestra una gran iglesia subterránea con lámparas de araña y relieves tallados en roca salina
pol_varsovia;Varsovia;[Link foto del Castillo Real y la plaza del mercado reconstruida];Capital de Polonia y la urbe más grande del país;Su centro histórico fue arrasado en la Segunda Guerra Mundial y reconstruido basándose en pinturas de época;Alberga un enorme Palacio de la Cultura regalo de Stalin durante la era soviética;Se ven coloridas fachadas clásicas meticulosamente restauradas en una animada plaza adoquinada
pol_gdansk;Gdańsk;[Link foto de la grúa medieval de madera o las fachadas del río];Importante ciudad portuaria en la costa del mar Báltico polaco;Cuna del movimiento sindical Solidaridad que desafió al bloque soviético;Líder mundial en la producción y comercio de ámbar;Aparece una singular y colosal grúa portuaria medieval de madera oscura junto a un río
dnk_copenhague;Copenhague;[Link foto del puerto de Nyhavn];Capital de la nación más antigua de Escandinavia;Promueve el concepto de hygge (comodidad y bienestar);Tiene un parque de atracciones en el centro (Tívoli) y la estatua de La Sirenita;Muestra un canal portuario flanqueado por casas antiguas de colores intensos y barcos de madera
dnk_aarhus;Aarhus;[Link foto del museo de arte ARoS con la pasarela arcoíris];Segunda ciudad más grande de Dinamarca situada en la península de Jutlandia;Es un gran centro universitario y cultural de perfil joven y moderno;Posee un popular museo de arte contemporáneo con una pasarela circular panorámica;En la parte superior de un museo cuadrado se ve una pasarela acristalada de los colores del arcoíris
swe_estocolmo;Estocolmo;[Link foto del casco antiguo Gamla Stan];Capital de Suecia;Su territorio urbano se reparte a través de catorce islas conectadas por puentes;Es la sede del comité que otorga los prestigiosos Premios Nobel;La foto resalta una pequeña plaza de estilo medieval con fachadas estrechas en tonos rojos naranjas y amarillos
swe_gotemburgo;Gotemburgo;[Link foto de los canales de Gotemburgo o Liseberg];Segunda ciudad sueca ubicada en la costa oeste;Fue fundada por holandeses lo que explica su diseño urbano original;Alberga la sede mundial del fabricante de automóviles Volvo;Muestra un aire más portuario e industrial con amplios canales y el perfil de una montaña rusa al fondo
nor_oslo;Oslo;[Link foto de la Casa de la Ópera inclinada];Capital y centro económico de Noruega;Ubicada al final de un fiordo y rodeada de espesos bosques vírgenes;Es la ciudad donde se otorga y entrega anualmente el Premio Nobel de la Paz;Destaca un moderno edificio de mármol blanco y cristal que parece un témpano de hielo sumergiéndose en el agua
nor_bergen;Bergen;[Link foto del muelle Bryggen de madera de colores];Segunda ciudad de Noruega;Ubicada en la costa suroeste y rodeada por siete montañas;Punto de partida principal para explorar los espectaculares fiordos del país;La imagen muestra un histórico muelle hanseático con casas de madera pintadas torcidas por el tiempo
nor_tromso;Tromsø;[Link foto de la Catedral del Ártico y la nieve];Ciudad situada a más de 300 kilómetros por encima del círculo polar ártico;Es uno de los mejores lugares de Europa para cazar auroras boreales en invierno;Tiene la universidad la cervecería y el jardín botánico más septentrionales del mundo;Aparece una vanguardista iglesia blanca con forma de picos de hielo a los pies de montañas nevadas
fin_helsinki;Helsinki;[Link foto de la Catedral blanca en la plaza];Capital nacional bañada por el mar Báltico;El diseño moderno la tecnología y las saunas son religión aquí;Es la puerta de entrada a Laponia;Destaca una imponente catedral neoclásica de un blanco brillante con cúpulas verdes
fin_rovaniemi;Rovaniemi;[Link foto del pueblo de Papá Noel o renos en la nieve];Capital de la inmensa región de Laponia en Finlandia;Su trazado urbano fue diseñado con forma de cabeza de reno tras ser destruida en la guerra;Oficialmente designada como el verdadero hogar de Papá Noel (Santa Claus);Muestra un poblado nevado de madera con una línea que marca exactamente el cruce del círculo polar ártico
isl_reikiavik;Reikiavik;[Link foto de la iglesia Hallgrimskirkja];Capital del país del fuego y el hielo;Ostenta el título de ser la capital de Estado más septentrional del mundo;Funciona casi íntegramente con energía geotérmica;Se aprecia una extraña iglesia de hormigón cuya forma se inspira en columnas de lava basáltica
est_tallin;Tallin;[Link foto de las murallas y torres con techos rojos];Capital de la nación más digitalizada de Europa (Estonia);Se encuentra justo enfrente de Finlandia cruzando el mar;Su casco viejo es uno de los que mejor conserva la estructura amurallada de Europa;La foto muestra torres defensivas medievales de piedra con tejados cónicos de color rojo
lva_riga;Riga;[Link foto de los edificios Art Nouveau o la plaza de la casa de las cabezas negras];Capital de Letonia y mayor urbe de los países bálticos;Fue un importante centro de la Liga Hanseática;Tiene la mayor concentración de arquitectura modernista (Art Nouveau) del planeta;En la imagen se ven unas vistosas casas gremiales medievales con decoraciones renacentistas en una plaza amplia
ltu_vilna;Vilna;[Link foto del castillo de Trakai o casco viejo];Capital de Lituania;Cuenta con una pequeña república independiente de artistas en su interior llamada Uzupis;Su centro histórico es de los más grandes del este de Europa con marcado estilo barroco;La vista incluye una torre de ladrillo rojo en lo alto de una colina verde o un castillo isleño cercano
svn_liubliana;Liubliana;[Link foto del puente de los Dragones];Capital de Eslovenia;Pequeña ciudad ecológica y sin coches en su centro histórico;El arquitecto Jože Plečnik diseñó gran parte de su apariencia actual;El elemento más famoso de la foto es un puente custodiado por fieras estatuas de dragones verdes de cobre
svn_bled;Lago Bled;[Link foto del lago con la isla central y la iglesia];Joya natural en los Alpes Julianos de Eslovenia;Tradicionalmente se llega al centro remando en una barca de madera llamada pletna;Se dice que tocar la campana de su iglesia concede deseos;Muestra un sereno lago glaciar con una única y diminuta isla arbolada coronada por una iglesia
bih_sarajevo;Sarajevo;[Link foto de Baščaršija o los mercados otomanos];Capital y principal ciudad de Bosnia y Herzegovina;Aquí ocurrió el asesinato que detonó la Primera Guerra Mundial;Es un símbolo histórico de la mezcla de culturas islámica ortodoxa católica y judía;Muestra un casco antiguo con estilo claramente otomano mercados de cobre y mezquitas antiguas
bih_mostar;Mostar;[Link foto del famoso puente de piedra de un arco];Ciudad de la región de Herzegovina;Marcada por la cicatriz de la guerra de los Balcanes en los años noventa;Tradicionalmente los jóvenes saltan desde su punto más alto hacia el río helado;La imagen es de un majestuoso puente otomano de piedra blanca en forma de arco sobre agua esmeralda
srb_belgrado;Belgrado;[Link foto de la Fortaleza de Kalemegdan o la iglesia de San Sava];Capital de la República de Serbia;Famosa por su inagotable y flotante vida nocturna en el río (los splavovi);Se sitúa exactamente en la confluencia de los inmensos ríos Danubio y Sava;Se ve un enorme templo ortodoxo blanco de cúpulas verdes o una vieja fortaleza dominando dos ríos
rou_bucarest;Bucarest;[Link foto del gigantesco Palacio del Parlamento];Capital y ciudad más poblada de Rumanía;A principios del siglo XX fue conocida como la pequeña París del Este;Sufrió drásticos cambios bajo el régimen comunista de Nicolae Ceaușescu;En la imagen domina de forma aplastante el que es el edificio administrativo civil más pesado del mundo
rou_bran;Castillo de Bran;[Link foto del castillo en la niebla o la colina];Ubicado en la región histórica de Transilvania;Realmente perteneció a la realeza rumana pero la cultura popular lo asignó a otra figura;Asociado mundialmente con la leyenda del conde Drácula de Bram Stoker;Se trata de una fortaleza gótica intimidante en lo alto de un peñasco rocoso
rou_sighisoara;Sighișoara;[Link foto de la Torre del Reloj y casas de colores];Ciudad amurallada en el corazón de la región de Transilvania;Es el lugar de nacimiento documentado del príncipe Vlad el Empalador;Uno de los pocos burgos medievales de Europa que sigue habitado;Se observan casas fortificadas pintadas de vivos tonos pastel y una torre del reloj coronada de cerámica
bgr_sofia;Sofía;[Link foto de la Catedral de Alejandro Nevski];Capital política y cultural de Bulgaria;A sus afueras se levantan las cimas nevadas del monte Vitosha;Durante su época comunista recibió una arquitectura monumental muy soviética;Lo más reconocible de la foto es una masiva catedral ortodoxa con cúpulas doradas y verde pastel
bgr_plovdiv;Plovdiv;[Link foto del antiguo teatro romano integrado en la ciudad];Segunda ciudad en importancia de Bulgaria;Se asienta sobre siete colinas y presume de ser la ciudad europea habitada ininterrumpidamente más antigua;El trazado urbano moderno convive con espectaculares ruinas clásicas descubiertas hace poco;Se ve un impresionante y grandioso teatro romano encajado literalmente en medio del casco antiguo
alb_tirana;Tirana;[Link foto de la plaza Skanderbeg o un búnker de hormigón];Capital nacional y centro económico de Albania;Tras la caída de su hermético régimen comunista el alcalde mandó pintar de colores brillantes sus grises edificios;El país entero está salpicado por miles de refugios antiaéreos circulares;Aparece una gran plaza peatonal o uno de estos extraños refugios de hormigón en forma de cúpula
mne_kotor;Kotor;[Link foto de la bahía y la antigua ciudad amurallada];Ciudad costera muy famosa en la nación de Montenegro;Rodeada de impresionantes acantilados de piedra caliza que parecen un fiordo noruego en el sur;En sus calles medievales los gatos campan a sus anchas y son el símbolo local;Se ve una profunda bahía azul oscuro rodeada de montañas gigantescas con un pequeño pueblo de piedra en un rincón
mkd_skopie;Skopie;[Link foto del puente de piedra o estatuas monumentales];Capital de Macedonia del Norte atravesada por el río Vardar;Fue el lugar de nacimiento de la Madre Teresa de Calcuta;Recientemente el gobierno invirtió millones en plagar la ciudad de inmensas estatuas neoclásicas y edificios barrocos nuevos;La foto destaca por una abundancia casi cómica de gigantescos monumentos de bronce y fachadas blancas sobre un río
svk_bratislava;Bratislava;[Link foto del castillo blanco y rectangular];Capital de Eslovaquia a muy escasos kilómetros de la frontera con Austria y Hungría;Una de las únicas capitales del mundo que hace frontera directa con dos países soberanos;El río Danubio es su principal arteria de comunicación y transporte;Aparece un sólido castillo de un blanco inmaculado con forma de caja o mesa volcada dominando una colina
